{
  "pack_id": "ideapress.core",
  "pack_version": "1.0.0",
  "schema_version": "1.0",
  "generated_at": "1970-01-01T00:00:00Z",
  "prompts": [
    {
      "prompt_id": "stages.notify.digest",
      "version": "1.0.0",
      "sha256": "sha256:21829b05324468ff96ddb14ea45d4ca3a3409c4d0928f1475089aa0467c276a0"
    }
  ],
  "pack_sha256": "sha256:2f0a1d2047e54d2dac5da63af4ee49a5e50c6bf931af9fe105374f73c89f6e7f"
}
